{"operation":"DOCUMENT_CONVERSION","inputArtifact":{"artifactId":"00000000-0000-4000-8000-000000000101","artifactClass":"RAW","role":"INPUT","key":"raw/sha256/aa/bb/aaaaaaaaaaaaaaaaaaaaaaaaaaaaaaaaaaaaaaaaaaaaaaaaaaaaaaaaaaaaaaaa/payload","mediaType":"application/pdf","byteLength":1024,"checksumAlgorithm":"SHA256","checksum":"aaaaaaaaaaaaaaaaaaaaaaaaaaaaaaaaaaaaaaaaaaaaaaaaaaaaaaaaaaaaaaaa","immutable":true,"createdAt":"2026-07-15T00:00:00.000Z"},"outputStagingPrefix":"staging/00000000-0000-4000-8000-000000000301/00000000-0000-4000-8000-000000000401","requestedOutputs":["PROVIDER_JSON","MARKDOWN"],"documentProfile":"REPORT","ocrMode":"AUTO","languageHints":["ar","en"],"textDirectionHint":"MIXED","preserveLayout":true,"extractTables":true,"extractImages":false,"pageRange":null,"providerOptions":{}}
